id	document_id	sentence_nr	content	code	title/text	curated/single	dataset	url
17222	M1826	2	Bei der Anbindung der Asberger an die Xantener Straße hat offenbar niemand an die Radfahrer gedacht.	premise	text	single	CD_M	https://www.raddialog.moers.de/dialoge/moerser-raddialog/schlechte-anbindung-der-asberger-die-xantener-strasse
17223	M1826	3	Als Radfahrer ist die Fahrbahn zu benutzen.	premise	text	single	CD_M	https://www.raddialog.moers.de/dialoge/moerser-raddialog/schlechte-anbindung-der-asberger-die-xantener-strasse
17224	M1826	4	Kommt nicht gleichzeitig ein Fahrzeuf an die Ampel, ist dort für Radfahrer Schluß, da die Induktionsschleifen nicht auf Radfahrer reagieren.	premise	text	single	CD_M	https://www.raddialog.moers.de/dialoge/moerser-raddialog/schlechte-anbindung-der-asberger-die-xantener-strasse
17225	M1826	5	Der Radfahrer könnte jetzt über die (rote!) Ampel auf den Radweg fahren, dieses wäre jedoch ein Rotlichtverstoß.	premise	text	single	CD_M	https://www.raddialog.moers.de/dialoge/moerser-raddialog/schlechte-anbindung-der-asberger-die-xantener-strasse
17226	M1826	6	Der Radfahrer könnte auch über den Gehweg den Radweg erreichen, aber auch das ist nicht erlaubt.	premise	text	single	CD_M	https://www.raddialog.moers.de/dialoge/moerser-raddialog/schlechte-anbindung-der-asberger-die-xantener-strasse
17227	M1826	7	Es bleibt dem Radfahrer also nur, als Füßgänger seinen Drahtesel bis zum Radweg zu schieben, um nicht den Argwohn der benachbarten Polizei zu wecken.	premise	text	single	CD_M	https://www.raddialog.moers.de/dialoge/moerser-raddialog/schlechte-anbindung-der-asberger-die-xantener-strasse
17228	M1826	8	Es wäre wünschenswert, die letzten ca. 50 Meter des rechsseitigen Gehweges durch entsprechende Beschilderung für die gemeinsame Benutzung für Fußgänger und Radfahrer freizugeben, damit der Radweg auf legalem Weg erreicht werden kann, ohne die Fahrt unnötig zu unterbrechen.	mpos	text	single	CD_M	https://www.raddialog.moers.de/dialoge/moerser-raddialog/schlechte-anbindung-der-asberger-die-xantener-strasse
17229	M1827	1	Lebensgefährliche Schlaglöcher am Gymnasium Filder Benden	premise	title	single	CD_M	https://www.raddialog.moers.de/dialoge/moerser-raddialog/lebensgefaehrliche-schlagloecher-am-gymnasium-filder-benden
17230	M1827	2	Als Radfahrer bleibt einem hier nur noch die Möglichkeit auf den viel zu engen Bürgersteig zu wechseln.	premise	text	single	CD_M	https://www.raddialog.moers.de/dialoge/moerser-raddialog/lebensgefaehrliche-schlagloecher-am-gymnasium-filder-benden
17231	M1827	3	Zusätzlich würde es die Geräuschkulisse deutlich reduzieren.	premise	text	single	CD_M	https://www.raddialog.moers.de/dialoge/moerser-raddialog/lebensgefaehrliche-schlagloecher-am-gymnasium-filder-benden
17232	M1827	4	Den wenn Autos mit Anhänger, Busse oder gar LKWs die Straße befahren rumpelt es ganz schön.	premise	text	single	CD_M	https://www.raddialog.moers.de/dialoge/moerser-raddialog/lebensgefaehrliche-schlagloecher-am-gymnasium-filder-benden
17233	M1828	1	Fehlender Radweg	premise	title	single	CD_M	https://www.raddialog.moers.de/dialoge/moerser-raddialog/fehlender-radweg-9
17234	M1828	2	Hallo, auf der Krefelder Strasse zwischen dem Hotel van der Valk und der Einmündung Hülshorstweg fehlt ein baulich getrennter Radweg zu einer viel befahrenen Landstrasse mit 70 und 100 km/h Geschwindigkeitsbegrenzung.	mpos	text	single	CD_M	https://www.raddialog.moers.de/dialoge/moerser-raddialog/fehlender-radweg-9
17235	M1828	3	Es steht nur der Seitenstreifen zur Verfügung.	premise	text	single	CD_M	https://www.raddialog.moers.de/dialoge/moerser-raddialog/fehlender-radweg-9
17236	M1828	4	Das ist höchst gefährlich, insbesondere wenn Kinder dort unterwegs sind.	premise	text	single	CD_M	https://www.raddialog.moers.de/dialoge/moerser-raddialog/fehlender-radweg-9
17237	M1828	5	Die nächsten alternativen Routen sind die Filder Strasse oder die Steinbrückenstrasse (wobei auch hier ein Radweg fehlt).	premise	text	single	CD_M	https://www.raddialog.moers.de/dialoge/moerser-raddialog/fehlender-radweg-9
17238	M1828	6	Diese sind jedoch für einen Radfahrer ein unzumutbarer Umweg.	premise	text	single	CD_M	https://www.raddialog.moers.de/dialoge/moerser-raddialog/fehlender-radweg-9
17239	M1828	7	Schönen Gruß Philipp V.	mpos	text	single	CD_M	https://www.raddialog.moers.de/dialoge/moerser-raddialog/fehlender-radweg-9
17240	M1829	1	Werbebanner vermindert die Sicht auf Radfahrer, Spaziergänger und Jogger	premise	title	single	CD_M	https://www.raddialog.moers.de/dialoge/moerser-raddialog/werbebanner-vermindert-die-sicht-auf-radfahrer-spaziergaenger-und-jogger
17241	M1829	2	An dieser Stelle verläuft der Radweg entgegengesetzt zur Fahrtrichtung des Autoverkehrs.	premise	text	single	CD_M	https://www.raddialog.moers.de/dialoge/moerser-raddialog/werbebanner-vermindert-die-sicht-auf-radfahrer-spaziergaenger-und-jogger
17242	M1829	3	Radfahrer aber auch Jogger die aus Richtung Westen nach Osten fahren/laufen werden häufig zu spät von Autofahrern die aus der Dorotheenstraße auf die L140 abbiegen gesehen.	premise	text	single	CD_M	https://www.raddialog.moers.de/dialoge/moerser-raddialog/werbebanner-vermindert-die-sicht-auf-radfahrer-spaziergaenger-und-jogger
17243	M1829	4	Ich beobachte oft, dass die Autofahrer nach links in den Verkehr der L140 schauen und dabei den Radweg ohne zu schauen überfahren.	premise	text	single	CD_M	https://www.raddialog.moers.de/dialoge/moerser-raddialog/werbebanner-vermindert-die-sicht-auf-radfahrer-spaziergaenger-und-jogger
17244	M1829	5	Zudem behindert am ein Werbebanner in Augenhöhe der Autofahrer am Zaun des Eckgrundstücks Dorotheenstraße/L140 die frühzeitige freie Sicht auf den Radweg.	premise	text	single	CD_M	https://www.raddialog.moers.de/dialoge/moerser-raddialog/werbebanner-vermindert-die-sicht-auf-radfahrer-spaziergaenger-und-jogger
17245	M1830	1	Sehr schlechter Zustand des Radweges	premise	title	single	CD_M	https://www.raddialog.moers.de/dialoge/moerser-raddialog/sehr-schlechter-zustand-des-radweges
17246	M1830	2	Sehr geehrte Damen und Herren, der Radweg zwischen Kapellen und Hülsdonk läßt absolut zu wünschen übrig.	premise	text	single	CD_M	https://www.raddialog.moers.de/dialoge/moerser-raddialog/sehr-schlechter-zustand-des-radweges
17247	M1830	3	Besonders schlecht ist die Strecke aus zwischen Kapellen und Autobahn.	premise	text	single	CD_M	https://www.raddialog.moers.de/dialoge/moerser-raddialog/sehr-schlechter-zustand-des-radweges
17248	M1830	4	Hier neigt man dazu eher die Straße zu benutzen, was natürlich nicht ungefährlich ist!!!	premise	text	single	CD_M	https://www.raddialog.moers.de/dialoge/moerser-raddialog/sehr-schlechter-zustand-des-radweges
17249	M1830	5	Warum ist ein Radweg überhaupt gepflastert und nicht geteert?	mpos	text	single	CD_M	https://www.raddialog.moers.de/dialoge/moerser-raddialog/sehr-schlechter-zustand-des-radweges
17250	M1830	6	Wann werden die vorhandenen Löcher behoben?	mpos	text	single	CD_M	https://www.raddialog.moers.de/dialoge/moerser-raddialog/sehr-schlechter-zustand-des-radweges
17251	M1830	7	Warum wird der Radweg immer schmaler, da sich scheinbar niemand um den Bewuchs rechts und links kümmert?	premise	text	single	CD_M	https://www.raddialog.moers.de/dialoge/moerser-raddialog/sehr-schlechter-zustand-des-radweges
17252	M1830	8	Warum ist die Strecke nicht beleuchtet?	premise	text	single	CD_M	https://www.raddialog.moers.de/dialoge/moerser-raddialog/sehr-schlechter-zustand-des-radweges
17253	M1830	9	Es wäre schön, wenn die Zustände sich bessern würden.	non-arg	text	single	CD_M	https://www.raddialog.moers.de/dialoge/moerser-raddialog/sehr-schlechter-zustand-des-radweges
17254	M1830	10	Viele Grüße [Name entfernt]	non-arg	text	single	CD_M	https://www.raddialog.moers.de/dialoge/moerser-raddialog/sehr-schlechter-zustand-des-radweges
17255	M1831	1	Radführung	non-arg	title	single	CD_M	https://www.raddialog.moers.de/dialoge/moerser-raddialog/radfuehrung
17256	M1831	2	Hier fehlt schon immer ein Radweg.	premise	text	single	CD_M	https://www.raddialog.moers.de/dialoge/moerser-raddialog/radfuehrung
17257	M1831	3	Nach dem schweren Unfall ist hier bisher immer noch nichts passiert.	premise	text	single	CD_M	https://www.raddialog.moers.de/dialoge/moerser-raddialog/radfuehrung
17258	M1831	4	Es fahren und laufen so gar Arbeiter die nach Copeo müssen und in der jetzigen Jahreszeit ist das sehr gefährlich.	premise	text	single	CD_M	https://www.raddialog.moers.de/dialoge/moerser-raddialog/radfuehrung
17259	M1832	1	Neubau der Lotharstrasse.	mpos	title	curated	CD_M	https://www.raddialog.moers.de/dialoge/moerser-raddialog/neubau-der-lotharstrasse
17260	M1832	2	Wenn Fahrradfahrer, so wie ich des Öfteren, von der Lotharstr. auf den Fahrradweg der Homberger einbiegen wollen gab es vor dem Umbau der Lotharstr. 2 erhebliche Gefahrenstellen.	premise	text	curated	CD_M	https://www.raddialog.moers.de/dialoge/moerser-raddialog/neubau-der-lotharstrasse
17261	M1832	3	1. Rechtsabbiegenden PKW fahren soweit rechts und schneiden den Fahrradbereich.	premise	text	curated	CD_M	https://www.raddialog.moers.de/dialoge/moerser-raddialog/neubau-der-lotharstrasse
17262	M1832	4	( Ist mir schon mehrfach passiert)	premise	text	curated	CD_M	https://www.raddialog.moers.de/dialoge/moerser-raddialog/neubau-der-lotharstrasse
17263	M1832	5	2. Wenn jemand mit dem Fahrrad in so einem stumpfen Winkel, wie es derzeit dort gebaut wird über eine Kante fahren soll, um auf die Hombergerstr. einzufahren, besteht Sturzgefahr.	premise	text	curated	CD_M	https://www.raddialog.moers.de/dialoge/moerser-raddialog/neubau-der-lotharstrasse
17264	M1832	6	besonders bei nicht so sicheren Fahrern.	premise	text	curated	CD_M	https://www.raddialog.moers.de/dialoge/moerser-raddialog/neubau-der-lotharstrasse
17265	M1832	7	Vorschlag: Den Fahradweg auf den Gehweg verlegen.	mpos	text	curated	CD_M	https://www.raddialog.moers.de/dialoge/moerser-raddialog/neubau-der-lotharstrasse
17266	M1832	8	Sollte das nicht möglich sein, die Kante absenken (sind nur ca. 2 cm.) und eine massive Abtrennung zur Autofahrspur installieren.	mpos	text	curated	CD_M	https://www.raddialog.moers.de/dialoge/moerser-raddialog/neubau-der-lotharstrasse
17267	M1832	9	[Name entfernt]	non-arg	text	curated	CD_M	https://www.raddialog.moers.de/dialoge/moerser-raddialog/neubau-der-lotharstrasse
17268	M1833	1	Radwegführung	non-arg	title	single	CD_M	https://www.raddialog.moers.de/dialoge/moerser-raddialog/radwegfuehrung-0
17269	M1833	2	Der Radweg von Kamp-Lintfort längs der Kamperstraße führt ab Autobahnkreuz Kamp-Lintfort nur rechts der Kamperstraße in Fahrtrichtung Moers.	premise	text	single	CD_M	https://www.raddialog.moers.de/dialoge/moerser-raddialog/radwegfuehrung-0
17270	M1833	3	Ab Kreuzung mit der Lintforterstraße bis Kreuzung Im Meerfeld/ Genenderstraße links in Fahrtrichtung, ab dieser Kreuzung beidseitig.	premise	text	single	CD_M	https://www.raddialog.moers.de/dialoge/moerser-raddialog/radwegfuehrung-0
17271	M1833	4	Hier muss der Radfahrer 2 x die Fahrbahnseite wechseln, was gerade an der Kamperstraße nicht ganz ungefährlich ist.	premise	text	single	CD_M	https://www.raddialog.moers.de/dialoge/moerser-raddialog/radwegfuehrung-0
17272	M1834	1	Radweg Richtung Neukirchen	non-arg	title	single	CD_M	https://www.raddialog.moers.de/dialoge/moerser-raddialog/radweg-richtung-neukirchen
17273	M1834	2	Es wäre viel sicherer, wenn es einen Radweg entlang der Krefelder Strasse zumindest bis zur Einfahrt  An der neuen Mühle  geben würde.	mpos+premise	text	single	CD_M	https://www.raddialog.moers.de/dialoge/moerser-raddialog/radweg-richtung-neukirchen
17274	M1834	3	Noch besser wäre ein Radweg durchgehend bis Neukirchen oder zumindest bis zum Tenwinkelshof.	mpos	text	single	CD_M	https://www.raddialog.moers.de/dialoge/moerser-raddialog/radweg-richtung-neukirchen
17275	M1834	4	Da wäre das Milch holen per Rad nicht mehr so gefährlich und man könnte auch mal die Kinder per Rad mit zum Tenwinkelshof nehmen.	premise	text	single	CD_M	https://www.raddialog.moers.de/dialoge/moerser-raddialog/radweg-richtung-neukirchen
17276	M1834	5	Das ist momentan nicht machbar entlang der Strasse, wo die Autos rasen.	premise	text	single	CD_M	https://www.raddialog.moers.de/dialoge/moerser-raddialog/radweg-richtung-neukirchen
17277	M1834	6	Schade !	non-arg	text	single	CD_M	https://www.raddialog.moers.de/dialoge/moerser-raddialog/radweg-richtung-neukirchen
17278	M1834	7	Ich fahre dort mehrmals pro Woche hin und fühle mich sehr unsicher auf dem Rad.	premise	text	single	CD_M	https://www.raddialog.moers.de/dialoge/moerser-raddialog/radweg-richtung-neukirchen
17279	M1835	1	Wurzelschäden	non-arg	title	single	CD_M	https://www.raddialog.moers.de/dialoge/moerser-raddialog/wurzelschaeden
17280	M1835	2	Auf der Venloer Straße gibt es leider viele Wurzelschäden.	premise	text	single	CD_M	https://www.raddialog.moers.de/dialoge/moerser-raddialog/wurzelschaeden
17281	M1835	3	Der Fahrradweg wölbt sich an vielen Stellen nach oben.	premise	text	single	CD_M	https://www.raddialog.moers.de/dialoge/moerser-raddialog/wurzelschaeden
17282	M1835	4	Harte Bruchlandung behindern das Fahren.	premise	text	single	CD_M	https://www.raddialog.moers.de/dialoge/moerser-raddialog/wurzelschaeden
17283	M1835	5	Sobald sich zwei Fahrräder entgegen kommen, entstehen häufig gefährliche Situationen.	premise	text	single	CD_M	https://www.raddialog.moers.de/dialoge/moerser-raddialog/wurzelschaeden
17284	M1836	1	Fehlender Radweg	premise	title	single	CD_M	https://www.raddialog.moers.de/dialoge/moerser-raddialog/fehlender-radweg-10
17285	M1836	2	Warum gibt es von Kapellen nach Moers Stadtmitte oder umgekehrt ab hier keinen vernünftigen Radweg mehr bis hinter das Hotel [Name entfernt] ?	premise	text	single	CD_M	https://www.raddialog.moers.de/dialoge/moerser-raddialog/fehlender-radweg-10
17286	M1836	3	An der Strasse darf 100 gefahren werden und es ist nur ein Seitenstreifen vorhanden.	premise	text	single	CD_M	https://www.raddialog.moers.de/dialoge/moerser-raddialog/fehlender-radweg-10
17287	M1836	4	Viele Leute aus Kapellen benutzen diese Strasse mit dem Fahrrad um in die Stadt zu kommen.	premise	text	single	CD_M	https://www.raddialog.moers.de/dialoge/moerser-raddialog/fehlender-radweg-10
17288	M1836	5	Auch etliche Schüler, was jetzt in der kommenden dunklen Jahreszeit wieder viele gefährliche Situationen mit sich bringen wird.	premise	text	single	CD_M	https://www.raddialog.moers.de/dialoge/moerser-raddialog/fehlender-radweg-10
17289	M1837	1	Verzicht auf Rechtsabbiegerspur	mpos	title	single	CD_M	https://www.raddialog.moers.de/dialoge/moerser-raddialog/verzicht-auf-rechtsabbiegerspur
17290	M1837	2	Man sollte auf die Rechtsabbiegerspur verzichten und stattdessen einen ordentlichen Fahrradweg anlegen.	mpos	text	single	CD_M	https://www.raddialog.moers.de/dialoge/moerser-raddialog/verzicht-auf-rechtsabbiegerspur
17291	M1837	3	Man könnte auch auf den Parkstreifen am Friedhof verzichten und vor der Verkehrsinsel eine Haltebereich für Radfahrer einrichten, die dann an der Insel die Rheinberger Straße gefahrlos überqueren könnten.	mpos	text	single	CD_M	https://www.raddialog.moers.de/dialoge/moerser-raddialog/verzicht-auf-rechtsabbiegerspur
17292	M1837	4	An dieser Stelle ist die Gefahr für die Radfahrer (viele Schülerinnen und Schüler) einfach zu groß.	premise	text	single	CD_M	https://www.raddialog.moers.de/dialoge/moerser-raddialog/verzicht-auf-rechtsabbiegerspur
17293	M1837	5	Die Maßnahme macht die Strecke natürlich für Autofahrer unattraktiv - aber Sicherheit geht vor!	mpos	text	single	CD_M	https://www.raddialog.moers.de/dialoge/moerser-raddialog/verzicht-auf-rechtsabbiegerspur
17294	M1837	6	Was passiert denn jetzt?	non-arg	text	single	CD_M	https://www.raddialog.moers.de/dialoge/moerser-raddialog/verzicht-auf-rechtsabbiegerspur
17295	M1837	7	Die Kids nutzen (erlaubterweise) den Bürgersteig und nehmen dann den Weg über die Ampel, um anschließend in Scharen auf der falschen Seite den Bürgersteig bis zur Gablesbergerstr. zu nutzen.	premise	text	single	CD_M	https://www.raddialog.moers.de/dialoge/moerser-raddialog/verzicht-auf-rechtsabbiegerspur
17296	M1837	8	Das habe ich hundertfach beobachtet - aber keinen scheint's zu stören.	non-arg	text	single	CD_M	https://www.raddialog.moers.de/dialoge/moerser-raddialog/verzicht-auf-rechtsabbiegerspur
17297	M1838	1	Raser	non-arg	title	single	CD_M	https://www.raddialog.moers.de/dialoge/moerser-raddialog/raser
17298	M1838	2	Hier rasen sehr viele Autos!	premise	text	single	CD_M	https://www.raddialog.moers.de/dialoge/moerser-raddialog/raser
17299	M1838	3	Kaum Platz zum ausweichen vorhanden.	premise	text	single	CD_M	https://www.raddialog.moers.de/dialoge/moerser-raddialog/raser
17300	M1838	4	Eine Bodenschwelle oder ein Blitzer würden sicherlich helfen	mpos	text	single	CD_M	https://www.raddialog.moers.de/dialoge/moerser-raddialog/raser
17301	M1839	1	Schwarze Piste	non-arg	title	single	CD_M	https://www.raddialog.moers.de/dialoge/moerser-raddialog/schwarze-piste
17302	M1839	2	Die Strecke ist ein Vergnügen für jeden Mountainbikefahrer mit guten Stoßdämpfer.	non-arg	text	single	CD_M	https://www.raddialog.moers.de/dialoge/moerser-raddialog/schwarze-piste
17303	M1839	3	Wenn Fußgänger oder andere Fahrradfahrer ebenso unterwegs sind, dann wird es so richtig spannend.	non-arg	text	single	CD_M	https://www.raddialog.moers.de/dialoge/moerser-raddialog/schwarze-piste
17304	M1839	4	Für den normalen Fahrradfahrer ist dieser Weg eine Zumutung und sehr gefährlich.!	premise	text	single	CD_M	https://www.raddialog.moers.de/dialoge/moerser-raddialog/schwarze-piste
17305	M1840	1	Große und tiefe Pfütze bei starkem Regen.	premise	title	single	CD_M	https://www.raddialog.moers.de/dialoge/moerser-raddialog/grosse-und-tiefe-pfuetze-bei-starkem-regen
17306	M1841	1	Radverkehrsführung	non-arg	title	single	CD_M	https://www.raddialog.moers.de/dialoge/moerser-raddialog/radverkehrsfuehrung-0
17307	M1841	2	Es wäre gut, wenn es vom Kreisverkehr Augustastrasse bis zur Moerser Musikschule einen Fahrradweg gäbe.	mpos	text	single	CD_M	https://www.raddialog.moers.de/dialoge/moerser-raddialog/radverkehrsfuehrung-0
17308	M1841	3	MfG [Name entfernt]	premise	text	single	CD_M	https://www.raddialog.moers.de/dialoge/moerser-raddialog/radverkehrsfuehrung-0
17309	M1842	1	Unzureichende Markierung - Gefahr!	premise	title	single	CD_M	https://www.raddialog.moers.de/dialoge/moerser-raddialog/unzureichende-markierung-gefahr
17310	M1842	2	An dieser Stelle, wenn Autofahrer von der Unterwallstrasse auf den Neuen Wall abbiegen möchten und man als Radfahrer geradeaus auf die Wilhelm-Schröder-Strasse fahren möchte, muss man immer sehr aufpassen, dass man nicht von hinten überfahren wird bzw. die Autofahrer die Absicht des Radfahrers wahrnehmen und entsprechend bremsen.	premise	text	single	CD_M	https://www.raddialog.moers.de/dialoge/moerser-raddialog/unzureichende-markierung-gefahr
17311	M1842	3	Hier wäre es sicherlich zur Erhöhung der Sicherheit sinnvoll, wenn auf den Radweg und die Radfahrer deutlicher aufmerksam gemacht wird.	mpos+premise	text	single	CD_M	https://www.raddialog.moers.de/dialoge/moerser-raddialog/unzureichende-markierung-gefahr
17312	M1842	4	Z.B. durch eine deutliche leuchtend rote Bodenmarkierung.	mpos	text	single	CD_M	https://www.raddialog.moers.de/dialoge/moerser-raddialog/unzureichende-markierung-gefahr
17313	M1842	5	Gruß	non-arg	text	single	CD_M	https://www.raddialog.moers.de/dialoge/moerser-raddialog/unzureichende-markierung-gefahr
17314	M1843	1	Radweg durch die Bushaltestelle	non-arg	title	curated	CD_M	https://www.raddialog.moers.de/dialoge/moerser-raddialog/radweg-durch-die-bushaltestelle
17315	M1843	2	Im Verlauf des Neuen Wall, v.a. in Fahrtrichtung Uerdinger Str. wird der Radweg ab der Einmündung Doktor-Hermann-Bähr-Str. bis zum Hanns-Albeck-Platz zwei mal mitten durch die Bushaltestelle und durch die Wartezone vor der Ampel geführt.	premise	text	curated	CD_M	https://www.raddialog.moers.de/dialoge/moerser-raddialog/radweg-durch-die-bushaltestelle
17316	M1843	3	Das sorgt regelmäßig zu Beinaheunfällen, Irritationen und Ärger bei allen Beteiligten weil Fußgänger den Radweg nicht beachten, sehr viele Menschen an der Haltestelle oder vor der Ampel warten, Passanten schnell zum Bus laufen müssen und andererseits Radfahrer oft zügig unterwegs sind.	premise	text	curated	CD_M	https://www.raddialog.moers.de/dialoge/moerser-raddialog/radweg-durch-die-bushaltestelle
17317	M1843	4	Hier wäre eine bauliche Trennung oder eine noch deutlichere Abtrennung von Rad- und Fußgängerbereich sinnvoll:	mpos	text	curated	CD_M	https://www.raddialog.moers.de/dialoge/moerser-raddialog/radweg-durch-die-bushaltestelle
17318	M1843	5	1. Möglichkeit: Verlegung des Radwegs direkt an die Strassenkante, dann kommt es nur im Falle des Bus Ein- und Ausstiegs oder der Grünphase der Ampeln zu Querverkehr.	mpos	text	curated	CD_M	https://www.raddialog.moers.de/dialoge/moerser-raddialog/radweg-durch-die-bushaltestelle
17319	M1843	6	2. Möglichkeit: Verlegung des Radwegs als eigenständig markierter Bereich auf die Strasse zwischen die haltenden Busse und die Fahrbahn.	mpos	text	curated	CD_M	https://www.raddialog.moers.de/dialoge/moerser-raddialog/radweg-durch-die-bushaltestelle
17320	M1843	7	In jedem Fall eine DEUTLICHE Markierung des Radwegs, dass die Fußgänger oder Autofahrer den Radweg erkennen.	mpos	text	curated	CD_M	https://www.raddialog.moers.de/dialoge/moerser-raddialog/radweg-durch-die-bushaltestelle
17321	M1844	1	zumindest ungünstig	non-arg	title	single	CD_M	https://www.raddialog.moers.de/dialoge/moerser-raddialog/zumindest-unguenstig
17322	M1844	2	Von der Kamperstraße kommend ist der Bürgersteig an der Straße Im Meerfeld für Radfahrer zur Mitbenutzung freigegeben - bis zur Einmündung der Straße Hinter dem Acker.	premise	text	single	CD_M	https://www.raddialog.moers.de/dialoge/moerser-raddialog/zumindest-unguenstig
17323	M1844	3	Ab (hinter) der Einmündung gibt es dann einen Radweg, dessen Nutzung verpflichtend ist.	premise	text	single	CD_M	https://www.raddialog.moers.de/dialoge/moerser-raddialog/zumindest-unguenstig
17324	M1844	4	Ein Auffahren auf den Radweg ist fast unmöglich bzw. zumindest schwierig, wenn PKW aus der Straße Hinter dem Acker kommend an der Einmündung anhalten (müssen) und damit die Auffahrt auf den Radweg versperren, zumindest erschweren.	premise	text	single	CD_M	https://www.raddialog.moers.de/dialoge/moerser-raddialog/zumindest-unguenstig
17325	M1844	5	Auch ändert sich wenig, wenn ich als Radfahrer direkt am Beginn der Einmündung schon auf die vorhandene Spur für Radfahrer einfahre.	premise	text	single	CD_M	https://www.raddialog.moers.de/dialoge/moerser-raddialog/zumindest-unguenstig
17326	M1845	1	Fahrradampel	non-arg	title	single	CD_M	https://www.raddialog.moers.de/dialoge/moerser-raddialog/fahrradampel
17327	M1845	2	Die Fahrradampel schaltet gleichzeitig auf grün wie die Autoampel, um vor Rechtsabbiegern geschützt zu sein sollte die Radampel 2-3 sek vorher auf grün schalten.	mpos+premise	text	single	CD_M	https://www.raddialog.moers.de/dialoge/moerser-raddialog/fahrradampel
17328	M1846	1	Künstliche Fahrbahnverengung	non-arg	title	single	CD_M	https://www.raddialog.moers.de/dialoge/moerser-raddialog/kuenstliche-fahrbahnverengung
17329	M1846	2	Hier gibt es eine Querungshilfe, wovon kein Fußgänger weiß an einer nicht unmöglichen Stelle, welche die Fahrbahn vereengt und dadurch zu Gefahren beim durchfahren führt, durch parkende Busse und schnellfahrende Autos, die nicht durch die Fahrbahnverengung und ungenutze Querungshilfe verlangsamt werden.	premise	text	single	CD_M	https://www.raddialog.moers.de/dialoge/moerser-raddialog/kuenstliche-fahrbahnverengung
17330	M1847	1	HelikopterEltern	non-arg	title	single	CD_M	https://www.raddialog.moers.de/dialoge/moerser-raddialog/helikoptereltern
17331	M1847	2	Eltern die ihre Kinder mit dem Auto zur Schule bringen gefährden durch ihr rücksichtsloses Verhalten, parken in 2ter und 3ter Reihe blockieren von Fahrtwegen, durchfahrende Radfahrer und andere Verkehrsteilnehmer.	premise	text	single	CD_M	https://www.raddialog.moers.de/dialoge/moerser-raddialog/helikoptereltern
17332	M1847	3	Zudem wird sich nicht an die Geschwindigkeitsbegrenzung gehalten.	premise	text	single	CD_M	https://www.raddialog.moers.de/dialoge/moerser-raddialog/helikoptereltern
17333	M1847	4	Umwidmung zur Radstrassen in dem Areal und Anliegerstrassen und verstärkte Kontrollen mit nicht nur angedrohten Strafen und eine Schaffung einer Helikopterabladezone könnten hier hilfreich sein.	mpos	text	single	CD_M	https://www.raddialog.moers.de/dialoge/moerser-raddialog/helikoptereltern
17334	M1847	5	Auch eine Verlegung der Ersatzhaltestelle für Schulbusse , sollte angedacht werden, da sie in der Regel nicht rangieren können und so zu einem kompletten Chaos führen.	mpos+premise	text	single	CD_M	https://www.raddialog.moers.de/dialoge/moerser-raddialog/helikoptereltern
17335	M1851	1	Falsche Beschilderung des Rad- und Fußweges	premise	title	single	CD_M	https://www.raddialog.moers.de/dialoge/moerser-raddialog/falsche-beschilderung-des-rad-und-fussweges
17336	M1851	2	Die Beschilderung des Rad- und Fußweges zwischen der Lintforter Str. und Im Meerfeld ist auf Höhe der Carlo-Schmid-Str. / Olof-Palme-Str. nicht korrekt.	premise	text	single	CD_M	https://www.raddialog.moers.de/dialoge/moerser-raddialog/falsche-beschilderung-des-rad-und-fussweges
17337	M1851	3	Die Schilder müssten m. E. genau anders herum angebracht sein, da ein Radweg immer an der Straßenseite verläuft.	premise	text	single	CD_M	https://www.raddialog.moers.de/dialoge/moerser-raddialog/falsche-beschilderung-des-rad-und-fussweges
17338	M1851	4	Schon vor über einem Jahr habe ich das zuständige Stadtamt 8.3 (Straßen-und Verkehrsrecht) per e-Mail darüber informiert.	premise	text	single	CD_M	https://www.raddialog.moers.de/dialoge/moerser-raddialog/falsche-beschilderung-des-rad-und-fussweges
