id	document_id	sentence_nr	content	code	title/text	curated/single	dataset	url
16778	M1725	1	Radschutzstreifen	non-arg	title	single	CD_M	https://www.raddialog.moers.de/dialoge/moerser-raddialog/radschutzstreifen
16779	M1725	2	Der Streifen wird von Verkehrsteilnehmern als alles wahrgenommen, allerdings nicht als Schutzstreifen für Radfahrer, zudem verblasst er schnell, da alle drüberfahren auch wenn Radfahrer sich darin bewegen.	premise	text	single	CD_M	https://www.raddialog.moers.de/dialoge/moerser-raddialog/radschutzstreifen
16780	M1726	1	Fehlende Beschilderung	premise	title	single	CD_M	https://www.raddialog.moers.de/dialoge/moerser-raddialog/fehlende-beschilderung
16781	M1726	2	Auf der Parsickstraße fehlt die Beschilderung nach links in den Bruckschenweg.	premise	text	single	CD_M	https://www.raddialog.moers.de/dialoge/moerser-raddialog/fehlende-beschilderung
16782	M1726	3	NRW-Radroute und Niederrhein-Route gehen hier links weiter.	premise	text	single	CD_M	https://www.raddialog.moers.de/dialoge/moerser-raddialog/fehlende-beschilderung
16783	M1727	1	Gefährlicher und häufig blockierter Übergang	premise	title	single	CD_M	https://www.raddialog.moers.de/dialoge/moerser-raddialog/gefaehrlicher-und-haeufig-blockierter-uebergang
16784	M1727	2	Von der Windmühlen-/Drosselstraße führt die Nebenroute der Niederrhein-Route über die Verbandsstraße.	premise	text	single	CD_M	https://www.raddialog.moers.de/dialoge/moerser-raddialog/gefaehrlicher-und-haeufig-blockierter-uebergang
16785	M1727	3	Das Verbindungsstück wird häufig als Parkplatz und neuerdings als Abstellplatz für bis zu drei Quads zweckentfremdet.	premise	text	single	CD_M	https://www.raddialog.moers.de/dialoge/moerser-raddialog/gefaehrlicher-und-haeufig-blockierter-uebergang
16786	M1727	4	Außerdem steht das Drängelgitter zu eng, vor allem, wenn man bedenkt, dass hier auch Tourenradler (mit Gepäcktaschen) unterwegs sind.	premise	text	single	CD_M	https://www.raddialog.moers.de/dialoge/moerser-raddialog/gefaehrlicher-und-haeufig-blockierter-uebergang
16787	M1727	5	Es müsste schräg aufgestellt sein - ebenso auf der gegenüberliegende Straßenseite.	mpos	text	single	CD_M	https://www.raddialog.moers.de/dialoge/moerser-raddialog/gefaehrlicher-und-haeufig-blockierter-uebergang
16788	M1727	6	Hat man das Drängelgitter (dennoch) passiert, muss man eine ca. 15 cm hohe Kante überwinden, um die Verbandsstraße überqueren zu können.	premise	text	single	CD_M	https://www.raddialog.moers.de/dialoge/moerser-raddialog/gefaehrlicher-und-haeufig-blockierter-uebergang
16789	M1727	7	Wenn man bedenkt, wie schnell die Autos hier oftmals unterwegs sind, kann das für Radler gefährlich werden, weil man wegen dieses Hindernisses nicht schnell genug wegkommt.	premise	text	single	CD_M	https://www.raddialog.moers.de/dialoge/moerser-raddialog/gefaehrlicher-und-haeufig-blockierter-uebergang
16790	M1728	1	Urteil des Bundesverwaltungsgerichts zur Radwegebenutzungspflicht	non-arg	title	single	CD_M	https://www.raddialog.moers.de/dialoge/moerser-raddialog/urteil-des-bundesverwaltungsgerichts-zur-radwegebenutzungspflicht
16791	M1728	2	Im Sommer konnte man in den örtlichen Zeitungen lesen, dass die Stadt das Urteil des Bundesverwaltungsgerichts zur Radwegebenutzungspflicht umgesetzt habe.	premise	text	single	CD_M	https://www.raddialog.moers.de/dialoge/moerser-raddialog/urteil-des-bundesverwaltungsgerichts-zur-radwegebenutzungspflicht
16792	M1728	3	Mich würde interessieren, nach welchen Kriterien entschieden worden ist, die Benutzungspflicht aufzuheben bzw. beizubehalten.	non-arg	text	single	CD_M	https://www.raddialog.moers.de/dialoge/moerser-raddialog/urteil-des-bundesverwaltungsgerichts-zur-radwegebenutzungspflicht
16793	M1728	4	Vor allem wird nicht immer ersichtlich, nach welchen Kriterien die Benutzungspflicht aufgehoben worden ist.	premise	text	single	CD_M	https://www.raddialog.moers.de/dialoge/moerser-raddialog/urteil-des-bundesverwaltungsgerichts-zur-radwegebenutzungspflicht
16794	M1728	5	Für mich ist folgendes Muster erkennbar: Immer da, wo Fahrbahnverengungen, Querungshilfen, parkende Autos etc. den Verkehrsfluss hemmen, dürfen Radler auf die Straße.	premise	text	single	CD_M	https://www.raddialog.moers.de/dialoge/moerser-raddialog/urteil-des-bundesverwaltungsgerichts-zur-radwegebenutzungspflicht
16795	M1728	6	Die Beschränkung auf 1.500 Zeichen erlaubt leider nicht, diese Einschätzung mit mehreren Beispielen zu unterlegen, daher nur eines von mehreren: Die Rathausallee in Utfort: Zwischen Rheinberger Straße und Baumstraße werden Autofahrer durch die vorgenannten Hindernisse ausgebremst.	premise	text	single	CD_M	https://www.raddialog.moers.de/dialoge/moerser-raddialog/urteil-des-bundesverwaltungsgerichts-zur-radwegebenutzungspflicht
16796	M1728	7	Zwischen Baumstraße und Rheinkamper Ring können Autofahrer Gas geben.	premise	text	single	CD_M	https://www.raddialog.moers.de/dialoge/moerser-raddialog/urteil-des-bundesverwaltungsgerichts-zur-radwegebenutzungspflicht
16797	M1728	8	Hier besteht Radwegebenutzungspflicht.	premise	text	single	CD_M	https://www.raddialog.moers.de/dialoge/moerser-raddialog/urteil-des-bundesverwaltungsgerichts-zur-radwegebenutzungspflicht
16798	M1728	9	Ab Rheinkamper Ring bis zur Schneckkull gibt es wieder getrennte Fuß- und Radwege, eine Bushaltestelle, Querungshilfen etc.	premise	text	single	CD_M	https://www.raddialog.moers.de/dialoge/moerser-raddialog/urteil-des-bundesverwaltungsgerichts-zur-radwegebenutzungspflicht
16799	M1728	10	Hier darf der Radfahrer wieder die Straße benutzen.	premise	text	single	CD_M	https://www.raddialog.moers.de/dialoge/moerser-raddialog/urteil-des-bundesverwaltungsgerichts-zur-radwegebenutzungspflicht
16800	M1728	11	Ab der Sandkull haben Autofahrer wieder freie Fahrt.	premise	text	single	CD_M	https://www.raddialog.moers.de/dialoge/moerser-raddialog/urteil-des-bundesverwaltungsgerichts-zur-radwegebenutzungspflicht
16801	M1728	12	Die Radfahrer muss die Straße wieder räumen.	premise	text	single	CD_M	https://www.raddialog.moers.de/dialoge/moerser-raddialog/urteil-des-bundesverwaltungsgerichts-zur-radwegebenutzungspflicht
16802	M1728	13	Ähnliches gilt u.a. für die Gutenbergstraße und die Izthak-Rabin-Straße bzw. im weiteren Verlauf die Lintforter Straße.	premise	text	single	CD_M	https://www.raddialog.moers.de/dialoge/moerser-raddialog/urteil-des-bundesverwaltungsgerichts-zur-radwegebenutzungspflicht
16803	M1729	1	Monsterwelle	premise	title	single	CD_M	https://www.raddialog.moers.de/dialoge/moerser-raddialog/monsterwelle
16804	M1729	2	Baumwurzel hebt den ohnehin schlechten Belag an einer Stelle extrem, man wird richtig ausgehebelt.	premise	text	single	CD_M	https://www.raddialog.moers.de/dialoge/moerser-raddialog/monsterwelle
16805	M1729	3	Wenn nicht erneuern des gesamten Weges möglich, wenigstens sichtbar machen dieses Hindernisses durch Farbe, da es erst im letzten Moment wahrgenommen werden kann.	mpos	text	single	CD_M	https://www.raddialog.moers.de/dialoge/moerser-raddialog/monsterwelle
16806	M1730	1	Schlechte Einsehbarkeit	premise	title	curated	CD_M	https://www.raddialog.moers.de/dialoge/moerser-raddialog/schlechte-einsehbarkeit
16807	M1730	2	Es handelt sich um einen einseitigen Radweg, abbiegende Verkehrsteilnehmer achten nicht auf Radfahrer.	premise	text	curated	CD_M	https://www.raddialog.moers.de/dialoge/moerser-raddialog/schlechte-einsehbarkeit
16808	M1731	1	Schlechte Einsehbarkeit	premise	title	single	CD_M	https://www.raddialog.moers.de/dialoge/moerser-raddialog/schlechte-einsehbarkeit-0
16809	M1731	2	Es handelt sich um einen einseitigen Radweg, abbiegende Verkehrsteilnehmer achten nicht auf Radfahrer.	premise	text	single	CD_M	https://www.raddialog.moers.de/dialoge/moerser-raddialog/schlechte-einsehbarkeit-0
16810	M1731	3	LEDs im Radweg, die so dem Verkehrsteilnehmer anzeigen, dass ein Radfahrer gleich die Fahrbahn passiert, ausgelöst durch Bodenkontakt einige Meter vorher auf dem Radweg...	mpos	text	single	CD_M	https://www.raddialog.moers.de/dialoge/moerser-raddialog/schlechte-einsehbarkeit-0
16811	M1732	1	Widerrechtlich linksabbiegende Autos	premise	title	single	CD_M	https://www.raddialog.moers.de/dialoge/moerser-raddialog/widerrechtlich-linksabbiegende-autos
16812	M1732	2	Viele Autos biegen von der Wilhelm-Schroeder-Str. links in den Ostring ab.	premise	text	single	CD_M	https://www.raddialog.moers.de/dialoge/moerser-raddialog/widerrechtlich-linksabbiegende-autos
16813	M1732	3	Gummipoller könnten dies verhindern, oder verstärkte Kontrollen.	mpos	text	single	CD_M	https://www.raddialog.moers.de/dialoge/moerser-raddialog/widerrechtlich-linksabbiegende-autos
16814	M1733	1	Widerrechtlich linksabbiegende Autos	premise	title	single	CD_M	https://www.raddialog.moers.de/dialoge/moerser-raddialog/widerrechtlich-linksabbiegende-autos-0
16815	M1733	2	Viele Autos biegen vom Parkdeck trotz Verbot links auf den neuen Wall und gefährden dadurch den Neuen Wall überquerende Radfahrer und Fußgänger.	premise	text	single	CD_M	https://www.raddialog.moers.de/dialoge/moerser-raddialog/widerrechtlich-linksabbiegende-autos-0
16816	M1733	3	Gummipoller oder verstärkte Kontrollen könnten dies verhindern.	mpos	text	single	CD_M	https://www.raddialog.moers.de/dialoge/moerser-raddialog/widerrechtlich-linksabbiegende-autos-0
16817	M1734	1	Schlechte Radwege	premise	title	single	CD_M	https://www.raddialog.moers.de/dialoge/moerser-raddialog/schlechte-radwege
16818	M1734	2	Gesamte Rheinbergerstr.	non-arg	text	single	CD_M	https://www.raddialog.moers.de/dialoge/moerser-raddialog/schlechte-radwege
16819	M1735	1	Radständer	non-arg	title	single	CD_M	https://www.raddialog.moers.de/dialoge/moerser-raddialog/radstaender
16820	M1735	2	Am Bahnhof gibt es ausser der Radstation keine Radständer...	premise	text	single	CD_M	https://www.raddialog.moers.de/dialoge/moerser-raddialog/radstaender
16821	M1736	1	Freigabe der Einbahnstr. Gellertstr. für Radfahrer	mpos	title	single	CD_M	https://www.raddialog.moers.de/dialoge/moerser-raddialog/freigabe-der-einbahnstr-gellertstr-fuer-radfahrer
16822	M1736	2	Warum wird die Gellertstr. nicht für Radfahrer freigegeben?	mpos	text	single	CD_M	https://www.raddialog.moers.de/dialoge/moerser-raddialog/freigabe-der-einbahnstr-gellertstr-fuer-radfahrer
16823	M1736	3	Sinn würde es sogar machen den gesamten Bereich Seminar-, Gellert-, Cloud-, Gabelsberger-, Diesterweg-, Landwehrstr. zu Radstrassen umzuwidmen, da aufgrund der vielen Schulen im Umkreis ein hohes Aufkommen an Schulverkehr ist und viele Arbeitnehmer zu Rad diese Strassen auch nutzen.	mpos+premise	text	single	CD_M	https://www.raddialog.moers.de/dialoge/moerser-raddialog/freigabe-der-einbahnstr-gellertstr-fuer-radfahrer
16824	M1736	4	Erweitern könnte man dies um eine Anliegerstr. um den Verkehr zu reduzieren.	mpos	text	single	CD_M	https://www.raddialog.moers.de/dialoge/moerser-raddialog/freigabe-der-einbahnstr-gellertstr-fuer-radfahrer
16825	M1737	1	Absolutes Halteverbot	non-arg	title	single	CD_M	https://www.raddialog.moers.de/dialoge/moerser-raddialog/absolutes-halteverbot
16826	M1737	2	Trotz absoluten Halteverbot parken immer wieder Autos oder Zulieferer der umgebenden Geschäfte in diesem Bereich, der enge Einfahrbrereich der Gabelsbergerstr wird dann zum Nadelöhr wo man als Radfahrer von abbiegegenden Autos gerne übersehen wird.	premise	text	single	CD_M	https://www.raddialog.moers.de/dialoge/moerser-raddialog/absolutes-halteverbot
16827	M1737	3	Die Einrichtung einer Ladezone wäre sinnig, damit der Kreuzungsbereich frei bleibt.	premise	text	single	CD_M	https://www.raddialog.moers.de/dialoge/moerser-raddialog/absolutes-halteverbot
16828	M1737	4	Zudem würden häufigere Kontrollen oder das Abschleppen der Fahrzeuge dies minimieren.	premise	text	single	CD_M	https://www.raddialog.moers.de/dialoge/moerser-raddialog/absolutes-halteverbot
16829	M1738	1	Gefahr bneim Quenren der Venloer Straße	premise	title	single	CD_M	https://www.raddialog.moers.de/dialoge/moerser-raddialog/gefahr-bneim-quenren-der-venloer-strasse
16830	M1738	2	Hier gibts es eine Bushaltestelle und es ist ein schöner Weg für Fußgänger und Radfahrer Richtung Vinner Friedhof und Sportpark am Solimar etc.	premise	text	single	CD_M	https://www.raddialog.moers.de/dialoge/moerser-raddialog/gefahr-bneim-quenren-der-venloer-strasse
16831	M1738	3	Leider kommt man hier kaum über die Straße!	premise	text	single	CD_M	https://www.raddialog.moers.de/dialoge/moerser-raddialog/gefahr-bneim-quenren-der-venloer-strasse
16832	M1739	1	Kein Weg von West nach Ost durch die Innenstadt	premise	title	single	CD_M	https://www.raddialog.moers.de/dialoge/moerser-raddialog/kein-weg-von-west-nach-ost-durch-die-innenstadt
16833	M1739	2	Wir fahren regelmäßig von Asberg nach Hülsdonk.	non-arg	text	single	CD_M	https://www.raddialog.moers.de/dialoge/moerser-raddialog/kein-weg-von-west-nach-ost-durch-die-innenstadt
16834	M1739	3	Der Hinweg ist noch halbwegs ok.	premise	text	single	CD_M	https://www.raddialog.moers.de/dialoge/moerser-raddialog/kein-weg-von-west-nach-ost-durch-die-innenstadt
16835	M1739	4	Von Hüldonk zurück gibt es keine radfahrerfreundliche Verkehrsführung - das führt dazu dass sich viele Radfahrer Verkehrswidrig irgendwie durch die Fußgängerzone schummeln.	premise	text	single	CD_M	https://www.raddialog.moers.de/dialoge/moerser-raddialog/kein-weg-von-west-nach-ost-durch-die-innenstadt
16836	M1740	1	Wie komme ich über die Römerstraße	non-arg	title	single	CD_M	https://www.raddialog.moers.de/dialoge/moerser-raddialog/wie-komme-ich-ueber-die-roemerstrasse
16837	M1740	2	Hier ist ein belibter Radwanderweg ausgeschildert.	premise	text	single	CD_M	https://www.raddialog.moers.de/dialoge/moerser-raddialog/wie-komme-ich-ueber-die-roemerstrasse
16838	M1740	3	Doch das Queren der Römerstraße ist extrem gefährlich!	premise	text	single	CD_M	https://www.raddialog.moers.de/dialoge/moerser-raddialog/wie-komme-ich-ueber-die-roemerstrasse
16839	M1741	1	Ampel Grafschafter Rad- und Wanderweg zu träge	premise	title	curated	CD_M	https://www.raddialog.moers.de/dialoge/moerser-raddialog/ampel-grafschafter-rad-und-wanderweg-zu-traege
16840	M1741	2	Die o.g. Ampelanlage zeigt viel zu selten GRÜN - die Rot-Pfasen sind zu lange.	premise	text	curated	CD_M	https://www.raddialog.moers.de/dialoge/moerser-raddialog/ampel-grafschafter-rad-und-wanderweg-zu-traege
16841	M1741	3	Fußgänger und Radfahrer queren 'verständlicherweise' bei ROT.	premise	text	curated	CD_M	https://www.raddialog.moers.de/dialoge/moerser-raddialog/ampel-grafschafter-rad-und-wanderweg-zu-traege
16842	M1741	4	Ampel sollte öfter Grün-Phasen zeigen.	mpos	text	curated	CD_M	https://www.raddialog.moers.de/dialoge/moerser-raddialog/ampel-grafschafter-rad-und-wanderweg-zu-traege
16843	M1741	5	Der PKW-Verkehr lääst es zu.	premise	text	curated	CD_M	https://www.raddialog.moers.de/dialoge/moerser-raddialog/ampel-grafschafter-rad-und-wanderweg-zu-traege
16844	M1742	1	Radweg entlang des Moersbachs	non-arg	title	single	CD_M	https://www.raddialog.moers.de/dialoge/moerser-raddialog/radweg-entlang-des-moersbachs
16845	M1742	2	Tatsächlich gibt es einen Weg von Rheinkamp bis in die Moerser Innenstadt entlang des Moersbachs, der von zahlreichen Radlern benutzt wird, obgleich er nur als Fußweg ausgewiesen ist.	premise	text	single	CD_M	https://www.raddialog.moers.de/dialoge/moerser-raddialog/radweg-entlang-des-moersbachs
16846	M1742	3	Besonders der neu angelegte Weg südlich der Rheurdter Straße eignet sich prima zum Radfahren.	premise	text	single	CD_M	https://www.raddialog.moers.de/dialoge/moerser-raddialog/radweg-entlang-des-moersbachs
16847	M1742	4	Weiter nördlich, insbesondere im Anschluss an die Sitzecke an der Trabrennbahn, ist er hingegen sehr holprig und auch für Fußgänger nicht ungefährlich (große Baumwurzeln, Unterführung unter der Rheurdter Straße viel zu steil, dort ist auch der Moersbach sehr unappetitlich).	premise	text	single	CD_M	https://www.raddialog.moers.de/dialoge/moerser-raddialog/radweg-entlang-des-moersbachs
16848	M1742	5	Der Weg als solcher hat einen hohen Freizeitwert, und es wäre schön, wenn er vollends für Radler erschlossen werden könnte.	mpos+premise	text	single	CD_M	https://www.raddialog.moers.de/dialoge/moerser-raddialog/radweg-entlang-des-moersbachs
16849	M1742	6	Mit freundlichen Grüßen [Name entfernt]	non-arg	text	single	CD_M	https://www.raddialog.moers.de/dialoge/moerser-raddialog/radweg-entlang-des-moersbachs
16850	M1743	1	Ampelschaltung	non-arg	title	single	CD_M	https://www.raddialog.moers.de/dialoge/moerser-raddialog/ampelschaltung-4
16851	M1743	2	Die Ampelschaltung vor der [Name entfernt]-Buchhandlung Richtung Königlicher Hof ist nicht gleich der Ampelschaktung Königlicher Hof Richtung [Name entfernt]-Buchhandlung.	premise	text	single	CD_M	https://www.raddialog.moers.de/dialoge/moerser-raddialog/ampelschaltung-4
16852	M1743	3	Ich komme z.B. mit dem Rad vom Königlichen Hof und habe Richtung [Buchhandlung] grün, die andere Seite hat aber schon rot.	premise	text	single	CD_M	https://www.raddialog.moers.de/dialoge/moerser-raddialog/ampelschaltung-4
16853	M1743	4	Der Busfahrer, der rechts von der Busspur abbiegt und nur auf die Fußgängerampel sieht, zieht durch, da er nur auf die rote Seite der Fußgängerampel sieht, ich als Radfahrer/Fußgänger habe aber in die andere Richtung noch grün.	premise	text	single	CD_M	https://www.raddialog.moers.de/dialoge/moerser-raddialog/ampelschaltung-4
16854	M1743	5	Oft wird man auch von Müttern mit kleinen Kindern beschimpft, man ginge bei rot über die Ampel, dabei hat die eine Füßgängerrichtung eher grün.	premise	text	single	CD_M	https://www.raddialog.moers.de/dialoge/moerser-raddialog/ampelschaltung-4
16855	M1743	6	Etwas verwirrend, man muss es selbst erleben.	premise	text	single	CD_M	https://www.raddialog.moers.de/dialoge/moerser-raddialog/ampelschaltung-4
16856	M1743	7	Vielleicht läßt sich die Ampelschaltung in beide Richtungen gleichstellen.	mpos	text	single	CD_M	https://www.raddialog.moers.de/dialoge/moerser-raddialog/ampelschaltung-4
16857	M1743	8	Danke MfG [Name entfernt]	non-arg	text	single	CD_M	https://www.raddialog.moers.de/dialoge/moerser-raddialog/ampelschaltung-4
16858	M1744	1	Fahren entlang der Landstraße	non-arg	title	single	CD_M	https://www.raddialog.moers.de/dialoge/moerser-raddialog/fahren-entlang-der-landstrasse
16859	M1744	2	Das Fahren entlang der Landstraße ist lebensgefährlich, es gibt auch keine nahegelegene Alternative.	premise	text	single	CD_M	https://www.raddialog.moers.de/dialoge/moerser-raddialog/fahren-entlang-der-landstrasse
16860	M1745	1	Qualität des Radweges	premise	title	single	CD_M	https://www.raddialog.moers.de/dialoge/moerser-raddialog/qualitaet-des-radweges
16861	M1745	2	Der Radweg ist übersäht mit Wurzelschäden wodurch teilweise ein sicheres fahren (vor allem für Kinder) sehr schwierig ist.	premise	text	single	CD_M	https://www.raddialog.moers.de/dialoge/moerser-raddialog/qualitaet-des-radweges
16862	M1746	1	Fehlender Radweg	premise	title	single	CD_M	https://www.raddialog.moers.de/dialoge/moerser-raddialog/fehlender-radweg-6
16863	M1746	2	Zwischen Am Steinbrink und der Stadtgrenze zu Duisburg fehlt ein Radweg.	premise	text	single	CD_M	https://www.raddialog.moers.de/dialoge/moerser-raddialog/fehlender-radweg-6
16864	M1746	3	Die Düsseldorfer Strasse ist in diesem Bereich sehr befahren und das Radfahren sehr gefährlich!	premise	text	single	CD_M	https://www.raddialog.moers.de/dialoge/moerser-raddialog/fehlender-radweg-6
16865	M1747	1	Ausbau Alternativroute	mpos	title	single	CD_M	https://www.raddialog.moers.de/dialoge/moerser-raddialog/ausbau-alternativroute
16866	M1747	2	Der landwirtschaftliche Weg zwischen der Repelener Straße und Liebrechtstraße entlang der Rheurdter Straße wird gerne von Fahrradfahrern genutzt.	premise	text	single	CD_M	https://www.raddialog.moers.de/dialoge/moerser-raddialog/ausbau-alternativroute
16867	M1747	3	Auf der Teilstück zwischen Moersbach und dem Gehöft an der Ecke Liebrechtstraße ist der Bodenbelag (grober Schotter) so schlecht, dass man um den Zustand des Rades bangen muss.	premise	text	single	CD_M	https://www.raddialog.moers.de/dialoge/moerser-raddialog/ausbau-alternativroute
16868	M1747	4	Hier ließe sich mit überschaubaren Mitteln eine erhebliche Verbesserung erzielen und den schönen Weg als Alternativroute und Abkürzung attraktiver machen.	mpos	text	single	CD_M	https://www.raddialog.moers.de/dialoge/moerser-raddialog/ausbau-alternativroute
16869	M1748	1	Absolutes Halteverbot	mpos	title	single	CD_M	https://www.raddialog.moers.de/dialoge/moerser-raddialog/absolutes-halteverbot-0
16870	M1748	2	Der markierte Radstreifen zwischen der Gabelsbergerstraße und der Baerler Straße ist eine der Hauptstrecken der Schülerinnen und Schüler des Adolfinums und der Hermann-Runge-Gesamtschule (aber auch vieler anderer Radfahrer).	premise	text	single	CD_M	https://www.raddialog.moers.de/dialoge/moerser-raddialog/absolutes-halteverbot-0
16871	M1748	3	Häufig wird die eh schon problematische Situation durch parkende Fahrzeuge auf dem Bürgersteig/dem Radweg verschärft, so dass man auf die enge Fahrbahn ausweichen muss.	premise	text	single	CD_M	https://www.raddialog.moers.de/dialoge/moerser-raddialog/absolutes-halteverbot-0
16872	M1748	4	Das ist extrem gefährlich und sollte durch ein absolutes Halteverbot verhindert werden, dass zumindest während der Zeiten mit dem größten Schülerverkehrsaufkommen gelten sollte.	mpos+premise	text	single	CD_M	https://www.raddialog.moers.de/dialoge/moerser-raddialog/absolutes-halteverbot-0
16873	M1749	1	Nutzung des Radweges in beide Richtungen	mpos	title	single	CD_M	https://www.raddialog.moers.de/dialoge/moerser-raddialog/nutzung-des-radweges-beide-richtungen
16874	M1749	2	Sehr viele Radfahrer (insbesondere Schülerinnen und Schüler) nutzen die Ampel Ecke Rheinberger Straße/Klever Straße, um auf dem Fahrradweg gegen die erlaubte Fahrtrichtung bis zur Ampel Rheurdter Straße zu fahren und dann über die Liebrechtstraße nach Utfort und Repelen zu gelangen.	premise	text	single	CD_M	https://www.raddialog.moers.de/dialoge/moerser-raddialog/nutzung-des-radweges-beide-richtungen
16875	M1749	3	Schlimmstenfalls überqueren die Radler schon vor der Ampel die Rheinberger Straße, um den Weg über das Teilstück Am Fünderich zu nehmen.	premise	text	single	CD_M	https://www.raddialog.moers.de/dialoge/moerser-raddialog/nutzung-des-radweges-beide-richtungen
16876	M1749	4	Ich schlage vor, den Weg über die Ampel zu legalisieren, indem man den Radweg zwischen Rheinberger Str. und Rheurdter Straße auch in Gegenrichtung für den Radverkehr freigibt und ggf. per Beschilderung die abbiegenden Autofahrer auf die Radler hinzuweisen.	mpos	text	single	CD_M	https://www.raddialog.moers.de/dialoge/moerser-raddialog/nutzung-des-radweges-beide-richtungen
16877	M1750	1	Radwegmarkierung Hülsdonk Geldernsche Strasse	non-arg	title	single	CD_M	https://www.raddialog.moers.de/dialoge/moerser-raddialog/radwegmarkierung-huelsdonk-geldernsche-strasse
16878	M1750	2	Die Geldernsche Strasse von der Hülsdonker Strasse in Richtung Neukirchen Vluyn ist ungewöhnlich breit ausgebaut.	premise	text	single	CD_M	https://www.raddialog.moers.de/dialoge/moerser-raddialog/radwegmarkierung-huelsdonk-geldernsche-strasse
16879	M1750	3	Ursprünglich soll sie als Autozubringer gedacht gewesen sein.	premise	text	single	CD_M	https://www.raddialog.moers.de/dialoge/moerser-raddialog/radwegmarkierung-huelsdonk-geldernsche-strasse
16880	M1750	4	Inzwischen wurde sie auf Höchstgeschwingigkeit 30 KM/h reduziert (obwohl sich hier viele nicht daran halten).	premise	text	single	CD_M	https://www.raddialog.moers.de/dialoge/moerser-raddialog/radwegmarkierung-huelsdonk-geldernsche-strasse
16881	M1750	5	Die Strasse ist nicht mit einem Radweg versehen.	premise	text	single	CD_M	https://www.raddialog.moers.de/dialoge/moerser-raddialog/radwegmarkierung-huelsdonk-geldernsche-strasse
16882	M1750	6	Viele Schulkinder und Radwanderer benutzen die Strasse ohne optisch getrennt von den Autofahrern zu sein.	premise	text	single	CD_M	https://www.raddialog.moers.de/dialoge/moerser-raddialog/radwegmarkierung-huelsdonk-geldernsche-strasse
16883	M1750	7	Mein Vorschlag ist daher, auf der Strasse rechts und links eine Trennlinie aufzutragen um damit deutlich den Radfahrern eine eigene Fahrspur zuzuordnen.	mpos	text	single	CD_M	https://www.raddialog.moers.de/dialoge/moerser-raddialog/radwegmarkierung-huelsdonk-geldernsche-strasse
16884	M1750	8	Ausserdem ist die Abbiegung von der abknickenden Vorfahrt in die Sandforter Strasse nicht mehr eindeutig zu erkennen.	premise	text	single	CD_M	https://www.raddialog.moers.de/dialoge/moerser-raddialog/radwegmarkierung-huelsdonk-geldernsche-strasse
16885	M1750	9	Hier müsste deutlicher auf die Radfahrer hingewiesen werden müssen.	mpos	text	single	CD_M	https://www.raddialog.moers.de/dialoge/moerser-raddialog/radwegmarkierung-huelsdonk-geldernsche-strasse
16886	M1751	1	Bushaltestelle (Absenkung Bordsteinkante)	mpos	title	single	CD_M	https://www.raddialog.moers.de/dialoge/moerser-raddialog/bushaltestelle-absenkung-bordsteinkante
16887	M1751	2	Vor der Einbiegung in die Geldernsche Strasse befindet sich auf der Hülsdonker Strasse eine Bushaltestelle in Fahrtrichtung Neukirchen-Vluyn.	premise	text	single	CD_M	https://www.raddialog.moers.de/dialoge/moerser-raddialog/bushaltestelle-absenkung-bordsteinkante
16888	M1751	3	Der Bürgersteig und der Radweg verjüngen sich in Höhe der Ausstiegsstelle.	premise	text	single	CD_M	https://www.raddialog.moers.de/dialoge/moerser-raddialog/bushaltestelle-absenkung-bordsteinkante
16889	M1751	4	Häufig kommt es dort zu Engpässen.	premise	text	single	CD_M	https://www.raddialog.moers.de/dialoge/moerser-raddialog/bushaltestelle-absenkung-bordsteinkante
