id	document_id	sentence_nr	content	code	title/text	curated/single	dataset	url
16226	M1598	7	Dazu müsste der Zaun, der nach dem Abriss der Kioske aufgebaut worden ist, auf die freigewordenen Fläche über gesamte Länge des Bussteiges verlegt werden, um Platz zu schaffen.	mpos	text	single	CD_M	https://www.raddialog.moers.de/dialoge/moerser-raddialog/gefahrenbereich-der-bushalte-stelle-moers-bahnhof-am-bushaltesteig-3-der
16227	M1598	8	Da der Bussteig 3 der am meisten frequentierte ist, sollte man darüber nachdenken, ob es nicht besser wäre, die dort haltenden Buslinien auf die Bussteige 4a - 4c und 5a - 5c zu verlegen.	mpos+premise	text	single	CD_M	https://www.raddialog.moers.de/dialoge/moerser-raddialog/gefahrenbereich-der-bushalte-stelle-moers-bahnhof-am-bushaltesteig-3-der
16228	M1598	9	Dafür ist doch seinerzeit der Busbahnhof mit seinen beiden Haltebuchten mit 6 Bussteigen angelegt worden.	premise	text	single	CD_M	https://www.raddialog.moers.de/dialoge/moerser-raddialog/gefahrenbereich-der-bushalte-stelle-moers-bahnhof-am-bushaltesteig-3-der
16229	M1598	10	Oder?	non-arg	text	single	CD_M	https://www.raddialog.moers.de/dialoge/moerser-raddialog/gefahrenbereich-der-bushalte-stelle-moers-bahnhof-am-bushaltesteig-3-der
16230	M1598	11	Dort sollte der eigentliche Busbetrieb über die Bühne gehen, nicht entlang der Homberger Str.	mpos+premise	text	single	CD_M	https://www.raddialog.moers.de/dialoge/moerser-raddialog/gefahrenbereich-der-bushalte-stelle-moers-bahnhof-am-bushaltesteig-3-der
16231	M1598	12	Zudem führt die Ampelregelung an der Essenberger Str. / Klever-/Xantener Str./Homberger Str. und Busbahnhof / Vinzenzstr. zur Verstopfung.	premise	text	single	CD_M	https://www.raddialog.moers.de/dialoge/moerser-raddialog/gefahrenbereich-der-bushalte-stelle-moers-bahnhof-am-bushaltesteig-3-der
16232	M1599	1	genauere Radweg-Führung in Holderberg an der Ampel Rtg. Kapellen	mpos	title	curated	CD_M	https://www.raddialog.moers.de/dialoge/moerser-raddialog/genauere-radweg-fuehrung-holderberg-der-ampel-rtg-kapellen
16233	M1599	2	Guten Tag.	non-arg	text	curated	CD_M	https://www.raddialog.moers.de/dialoge/moerser-raddialog/genauere-radweg-fuehrung-holderberg-der-ampel-rtg-kapellen
16234	M1599	3	Auf dem Weg zum Apfelfest suchte ich einen Radweg von Moers Mitte aus Richtung Kapellen fahrend schon einmal rechts auf Höhe der Eissporthalle vergeblich.	premise	text	curated	CD_M	https://www.raddialog.moers.de/dialoge/moerser-raddialog/genauere-radweg-fuehrung-holderberg-der-ampel-rtg-kapellen
16235	M1599	4	Hatte mich nun an das Linksfahren gewöhnt, als ich hinter der Moerser Str. 92 an der Ampel in Holderberg plötzlich rechts einen Radweg beginnen sah.	premise	text	curated	CD_M	https://www.raddialog.moers.de/dialoge/moerser-raddialog/genauere-radweg-fuehrung-holderberg-der-ampel-rtg-kapellen
16236	M1599	5	Ich überquerte also die Straße, da ja gegen das Linksfahren in Moers gerade auch eine Initiative lief.	premise	text	curated	CD_M	https://www.raddialog.moers.de/dialoge/moerser-raddialog/genauere-radweg-fuehrung-holderberg-der-ampel-rtg-kapellen
16237	M1599	6	Jedoch endete der Radweg direkt nach 25m wieder, so dass ich ein zweites Mal die Straße kreuzen musste.	premise	text	curated	CD_M	https://www.raddialog.moers.de/dialoge/moerser-raddialog/genauere-radweg-fuehrung-holderberg-der-ampel-rtg-kapellen
16238	M1599	7	Eine genauere Radweg-Angabe an der Stelle wäre hilfreich.	mpos	text	curated	CD_M	https://www.raddialog.moers.de/dialoge/moerser-raddialog/genauere-radweg-fuehrung-holderberg-der-ampel-rtg-kapellen
16239	M1599	8	Vielleicht einfach die Markierung rechts wegnehmen, damit man nicht binnen 25m zwei Mal rüber und nüber muss.	mpos+premise	text	curated	CD_M	https://www.raddialog.moers.de/dialoge/moerser-raddialog/genauere-radweg-fuehrung-holderberg-der-ampel-rtg-kapellen
16240	M1599	9	Danke.	non-arg	text	curated	CD_M	https://www.raddialog.moers.de/dialoge/moerser-raddialog/genauere-radweg-fuehrung-holderberg-der-ampel-rtg-kapellen
16241	M1600	1	Beschilderung	non-arg	title	single	CD_M	https://www.raddialog.moers.de/dialoge/moerser-raddialog/beschilderung-0
16242	M1600	2	An o.g. Kreisverkehr gilt für Radfahrer Vorfahrt gewähren beim Durchfahren des Kreisverkehrs.	premise	text	single	CD_M	https://www.raddialog.moers.de/dialoge/moerser-raddialog/beschilderung-0
16243	M1600	3	Da bei den meisten Kreisverkehren die Radfahrer Vorrang haben, achtet kaum ein Radfahrer auf ein Vorfahrt gewähren Schild.	premise	text	single	CD_M	https://www.raddialog.moers.de/dialoge/moerser-raddialog/beschilderung-0
16244	M1600	4	Da kaum ein Radfahrer dieses Schild beachtet, muß man als Autofahrer bremsen, damit es nicht zu einem Unfall kommt.	premise	text	single	CD_M	https://www.raddialog.moers.de/dialoge/moerser-raddialog/beschilderung-0
16245	M1600	5	Außerdem hängen die Schilder für die Radfahrer relativ hoch und nicht in direkte Sichthöhe!	premise	text	single	CD_M	https://www.raddialog.moers.de/dialoge/moerser-raddialog/beschilderung-0
16246	M1600	6	Als Radfahrer schaue ich eher zum Boden als noch oben.	premise	text	single	CD_M	https://www.raddialog.moers.de/dialoge/moerser-raddialog/beschilderung-0
16247	M1600	7	Vielleicht sollte man besser eine Bodenmarkierung machen.	mpos	text	single	CD_M	https://www.raddialog.moers.de/dialoge/moerser-raddialog/beschilderung-0
16248	M1601	1	Entschärfung Hoher Weg	mpos	title	single	CD_M	https://www.raddialog.moers.de/dialoge/moerser-raddialog/entschaerfung-hoher-weg
16249	M1601	2	Die Strecke Rheinberger Strasse / Hoher Weg bis Lintforter Strasse wird häufig von Radfahrern auch von Radfahrergruppen genutzt.	premise	text	single	CD_M	https://www.raddialog.moers.de/dialoge/moerser-raddialog/entschaerfung-hoher-weg
16250	M1601	3	Einen Fahrradweg gibt es auf dem Hohen Weg allerdings nicht.	premise	text	single	CD_M	https://www.raddialog.moers.de/dialoge/moerser-raddialog/entschaerfung-hoher-weg
16251	M1601	4	PKWs, LkWs, Mortorräder und Radfahrer müssen sich die asphaltierte Straße teilen was immer wieder zu gefährlichen Begegnungen führt.	premise	text	single	CD_M	https://www.raddialog.moers.de/dialoge/moerser-raddialog/entschaerfung-hoher-weg
16252	M1601	5	Eine Radwegeinrichtung auf einem Teilstück des Hohen Weges von der Rheinberger Strasse bis zur Pattbergstrasse (z.B. in Form eine Farbmarkierung auf der Fahrbahn) würde deutliche Hilfe bringen.	mpos	text	single	CD_M	https://www.raddialog.moers.de/dialoge/moerser-raddialog/entschaerfung-hoher-weg
16253	M1601	6	Noch besser wäre eine duch bauliche Maßnahmen zu schaffende Trennung von Auto und Radfahrer, aber ich fürchte aufgrund der Kosten wir diese Maßnahme niemals umgesetzt.	mpos	text	single	CD_M	https://www.raddialog.moers.de/dialoge/moerser-raddialog/entschaerfung-hoher-weg
16254	M1604	1	Alltags-Radverkehr nach Rheinberg	non-arg	title	single	CD_M	https://www.raddialog.moers.de/dialoge/moerser-raddialog/alltags-radverkehr-nach-rheinberg
16255	M1604	2	Die Alltagsstrecke nach Rheinberg verläuft im Norden von Moers absolut gradlinig entlang der ehemaligen Bundesstraße B 57.	premise	text	single	CD_M	https://www.raddialog.moers.de/dialoge/moerser-raddialog/alltags-radverkehr-nach-rheinberg
16256	M1604	3	Es gibt nur einen Radweg und die Lärmbelastung ist generell erheblich.	premise	text	single	CD_M	https://www.raddialog.moers.de/dialoge/moerser-raddialog/alltags-radverkehr-nach-rheinberg
16257	M1604	4	Bei Dunkelheit wir man als Radfahrer in Richtung Rheinberg stark geblendet.	premise	text	single	CD_M	https://www.raddialog.moers.de/dialoge/moerser-raddialog/alltags-radverkehr-nach-rheinberg
16258	M1604	5	Erst ab der Gärtnerrei den Driver gibt es Alternativrouten.	premise	text	single	CD_M	https://www.raddialog.moers.de/dialoge/moerser-raddialog/alltags-radverkehr-nach-rheinberg
16259	M1604	6	Es besteht erheblicher Verbesserungsbedarf !!!	premise	text	single	CD_M	https://www.raddialog.moers.de/dialoge/moerser-raddialog/alltags-radverkehr-nach-rheinberg
16260	M1605	1	Anforderung für Radfahrer und Gefahr durch Linksabbieger	premise	title	single	CD_M	https://www.raddialog.moers.de/dialoge/moerser-raddialog/anforderung-fuer-radfahrer-und-gefahr-durch-linksabbieger
16261	M1605	2	a) Der Anforderungskontakt reagiert sehr träge.	premise	text	single	CD_M	https://www.raddialog.moers.de/dialoge/moerser-raddialog/anforderung-fuer-radfahrer-und-gefahr-durch-linksabbieger
16262	M1605	3	Die Anforderung muss sowohl von Kapellen in Richtung Innenstadt als auch in umgekehrter Richtung auf der gegenüberliegenden Seite eine geraume Zeit vor der KFZ-Schaltung auf Grün gegeben werden.	premise	text	single	CD_M	https://www.raddialog.moers.de/dialoge/moerser-raddialog/anforderung-fuer-radfahrer-und-gefahr-durch-linksabbieger
16263	M1605	4	Sonst bekommt der KFZ-Verkehr Grün, ohne dass das Radfahrsignal mitgeschaltet wird.	premise	text	single	CD_M	https://www.raddialog.moers.de/dialoge/moerser-raddialog/anforderung-fuer-radfahrer-und-gefahr-durch-linksabbieger
16264	M1605	5	Da die Umläufe sehr lange dauern, ist die Wartezeit an der Ampel dadurch häufig sehr lang.	premise	text	single	CD_M	https://www.raddialog.moers.de/dialoge/moerser-raddialog/anforderung-fuer-radfahrer-und-gefahr-durch-linksabbieger
16265	M1605	6	Dies ist insbesondere spät abends und nachts ein Ärgernis, da die Umläufe, auch wenn keine Autos auf der Venloer Straße mehr fahren, sehr lange dauert und die Kreuzung komplett dunkel und Abseits jeder sozialen Kontrolle ist.	premise	text	single	CD_M	https://www.raddialog.moers.de/dialoge/moerser-raddialog/anforderung-fuer-radfahrer-und-gefahr-durch-linksabbieger
16266	M1605	7	b) von der Innenstadt kommend in Richtung Kapellen: Es kommt (wenn auch selten) vor, dass die Linksabbieger (von van der Valk kommend, links auf die Venloer Straße Rtg. N-V abbiegend) den grünen Abbiegepfeil der Ampel haben und so ohne Gegenverkehr abbiegen können.	premise	text	single	CD_M	https://www.raddialog.moers.de/dialoge/moerser-raddialog/anforderung-fuer-radfahrer-und-gefahr-durch-linksabbieger
16267	M1605	8	Es passiert gelegentlich, dass im gleichen Umlauf der grüne Pfeil erlischt, die Autos das normale grüne Ampellicht bekommen und weiter abbiegen, ohne dies zu realisieren.	premise	text	single	CD_M	https://www.raddialog.moers.de/dialoge/moerser-raddialog/anforderung-fuer-radfahrer-und-gefahr-durch-linksabbieger
16268	M1605	9	Da der Radfahrer etwas eher Grün als der KFZ-Verkehr (Krefelder Straße aus der Stadt kommend in Richtung Kapellen) bekommt, biegen die Autos weiterhin ohne Gegenverkehr ab, prallen aber auf den Radfahrer, der nun regulär Grün bekommen hat.	premise	text	single	CD_M	https://www.raddialog.moers.de/dialoge/moerser-raddialog/anforderung-fuer-radfahrer-und-gefahr-durch-linksabbieger
16269	M1605	10	Dies hat schon manches Mal für unschöne Situationen gesorgt, da der Autofahrer nach wie vor denkt, dem Grünen Abbiegersignal gefolgt zu sein.	premise	text	single	CD_M	https://www.raddialog.moers.de/dialoge/moerser-raddialog/anforderung-fuer-radfahrer-und-gefahr-durch-linksabbieger
16270	M1606	1	Radweg neben der B60 im Bereich Vinn und Hülsdonk	non-arg	title	single	CD_M	https://www.raddialog.moers.de/dialoge/moerser-raddialog/radweg-neben-der-b60-im-bereich-vinn-und-huelsdonk
16271	M1606	2	An der B60 steht nur ein Radweg für beide Richtungen bereits.	premise	text	single	CD_M	https://www.raddialog.moers.de/dialoge/moerser-raddialog/radweg-neben-der-b60-im-bereich-vinn-und-huelsdonk
16272	M1606	3	Gleichzeitig ist er auch für Spaziergänger, wird von Hundeliebhabern (...mit langen Leinen) , Eltern mit Kinderwagen u. Kleinkindern, stark frequentiert, Als Ebike Fahrer stellt sich der Radweg als eine Katastrophe darf.	premise	text	single	CD_M	https://www.raddialog.moers.de/dialoge/moerser-raddialog/radweg-neben-der-b60-im-bereich-vinn-und-huelsdonk
16273	M1606	4	Zudem hängen nicht geschnittenen Zweige von Sträuchern und Büschen in den Radweg, mann hat ständig Zweige im Gesicht.	premise	text	single	CD_M	https://www.raddialog.moers.de/dialoge/moerser-raddialog/radweg-neben-der-b60-im-bereich-vinn-und-huelsdonk
16274	M1606	5	Der Asphalt/Plasterung ist von Baumwurzeln stark uneben, hochgedrückt.	premise	text	single	CD_M	https://www.raddialog.moers.de/dialoge/moerser-raddialog/radweg-neben-der-b60-im-bereich-vinn-und-huelsdonk
16275	M1606	6	Zudem ist die Ampelschaltung nicht Fahrrad freundlich.	premise	text	single	CD_M	https://www.raddialog.moers.de/dialoge/moerser-raddialog/radweg-neben-der-b60-im-bereich-vinn-und-huelsdonk
16276	M1606	7	Ständig muß man absteigen, die Ampel drücken und auch eine Grünphase zu bekommen.	premise	text	single	CD_M	https://www.raddialog.moers.de/dialoge/moerser-raddialog/radweg-neben-der-b60-im-bereich-vinn-und-huelsdonk
16277	M1606	8	Alles gaaaaaaaaaaaaaaaaaaaanz schlecht, mangelhaft.	non-arg	text	single	CD_M	https://www.raddialog.moers.de/dialoge/moerser-raddialog/radweg-neben-der-b60-im-bereich-vinn-und-huelsdonk
16278	M1606	9	Als Asberger Bürger steht gleich zu Beginn der Asberger Str./ B 60 ein Schild  Fahrradfreundlich Stadt....lächerlich!	premise	text	single	CD_M	https://www.raddialog.moers.de/dialoge/moerser-raddialog/radweg-neben-der-b60-im-bereich-vinn-und-huelsdonk
16279	M1606	10	das Schild empfinden wir als Veräppelung.	premise	text	single	CD_M	https://www.raddialog.moers.de/dialoge/moerser-raddialog/radweg-neben-der-b60-im-bereich-vinn-und-huelsdonk
16280	M1606	11	Fahren Sie als Verantwortliche mal nach Venlo, schauen Sie sich dort die Radwegssitutation an.	non-arg	text	single	CD_M	https://www.raddialog.moers.de/dialoge/moerser-raddialog/radweg-neben-der-b60-im-bereich-vinn-und-huelsdonk
16281	M1607	1	Pfützen an der Umlaufschranke	premise	title	single	CD_M	https://www.raddialog.moers.de/dialoge/moerser-raddialog/pfuetzen-der-umlaufschranke
16282	M1607	2	Hie befinden sich nach Regenfällen häufig große tiefe Pfützen, die nur sehr langsam abtrocknen.	premise	text	single	CD_M	https://www.raddialog.moers.de/dialoge/moerser-raddialog/pfuetzen-der-umlaufschranke
16283	M1609	1	gefährlicher benutzungspflichtiger Radweg	premise	title	single	CD_M	https://www.raddialog.moers.de/dialoge/moerser-raddialog/gefaehrlicher-benutzungspflichtiger-radweg
16284	M1609	2	Von Homberg kommend: Auf einer Strecke von ca. 40 m befindet sich rechts neben einer Rechtsabbiegerspur der Fahrbahn ein Stück benutzungspflichtiger Radweg.	premise	text	single	CD_M	https://www.raddialog.moers.de/dialoge/moerser-raddialog/gefaehrlicher-benutzungspflichtiger-radweg
16285	M1609	3	Der Radweg an der Römer Straße davor und dahinter ist - rechtskonform - nicht benutzungspflichtig.	premise	text	single	CD_M	https://www.raddialog.moers.de/dialoge/moerser-raddialog/gefaehrlicher-benutzungspflichtiger-radweg
16286	M1609	4	Begründung für diese Benutzungspflicht, so war vor kurzem in der WAZ zu lesen sei, dass Rad- und Fußweg an dieser Stelle nicht nebeneinander, sondern gemeinsam verlaufen.	premise	text	single	CD_M	https://www.raddialog.moers.de/dialoge/moerser-raddialog/gefaehrlicher-benutzungspflichtiger-radweg
16287	M1609	5	Die richtige Beschilderung dafür ist aber Fußgängerweg, Radfahrer frei.	premise	text	single	CD_M	https://www.raddialog.moers.de/dialoge/moerser-raddialog/gefaehrlicher-benutzungspflichtiger-radweg
16288	M1609	6	Radfahrer, die den Radweg benutzen und weiter geradeaus fahren wollen, stehen nach wenigen Metern vor dem Schild Radweg Ende und müssen sich dann durch die auf de Straße fahrenden Rechtsabbieger wieder auf die mittlere Fahrspur begeben.	premise	text	single	CD_M	https://www.raddialog.moers.de/dialoge/moerser-raddialog/gefaehrlicher-benutzungspflichtiger-radweg
16289	M1609	7	Es ist dringend erforderlich, die Benutzungspflicht an der Stelle aufzuheben und den Fußweg statt dessen (für die Radfahrer, die sich auf der Strße nicht sicher fühlen) für Radler freizugeben.	mpos	text	single	CD_M	https://www.raddialog.moers.de/dialoge/moerser-raddialog/gefaehrlicher-benutzungspflichtiger-radweg
16290	M1610	1	Benutzungspflichtiger Radweg an einer Bushaltestelle	non-arg	title	single	CD_M	https://www.raddialog.moers.de/dialoge/moerser-raddialog/benutzungspflichtiger-radweg-einer-bushaltestelle
16291	M1610	2	Von Homberg kommend: Im Bereich einer Bushaltestelle befindet sich ein ca. 20 m langes Stück benutzungspflichtiger Radweg.	premise	text	single	CD_M	https://www.raddialog.moers.de/dialoge/moerser-raddialog/benutzungspflichtiger-radweg-einer-bushaltestelle
16292	M1610	3	Der Radweg an der Römer Straße davor und dahinter ist - rechtskonform - nicht benutzungspflichtig.	premise	text	single	CD_M	https://www.raddialog.moers.de/dialoge/moerser-raddialog/benutzungspflichtiger-radweg-einer-bushaltestelle
16293	M1610	4	Begründung für diese Benutzungspflicht, so war vor kurzem in der WAZ zu lesen sei, dass Rad- und Fußweg an dieser Stelle wegen der Enge nicht nebeneinander, sondern gemeinsam verlaufen.	premise	text	single	CD_M	https://www.raddialog.moers.de/dialoge/moerser-raddialog/benutzungspflichtiger-radweg-einer-bushaltestelle
16294	M1610	5	Die richtige Beschilderung dafür ist aber Fußgängerweg, Radfahrer frei.	premise	text	single	CD_M	https://www.raddialog.moers.de/dialoge/moerser-raddialog/benutzungspflichtiger-radweg-einer-bushaltestelle
16295	M1610	6	Radfahrer, die den sehr engen gemeinsamen Fuß- und Radweg benutzen, treffen auf Fußgänger, die auf den Bus warten bzw. gerade ein- oder aussteigen.	premise	text	single	CD_M	https://www.raddialog.moers.de/dialoge/moerser-raddialog/benutzungspflichtiger-radweg-einer-bushaltestelle
16296	M1610	7	Dies birgt ein sehr hohes Gefahrenpotenzial für alle.	premise	text	single	CD_M	https://www.raddialog.moers.de/dialoge/moerser-raddialog/benutzungspflichtiger-radweg-einer-bushaltestelle
16297	M1610	8	Es ist dringend erforderlich und vor allem StVO-konform, die Benutzungspflicht an der Stelle aufzuheben und den Fußweg statt dessen (für die Radfahrer, die sich auf der Straße nicht sicher fühlen) für Radler lediglich freizugeben.	mpos	text	single	CD_M	https://www.raddialog.moers.de/dialoge/moerser-raddialog/benutzungspflichtiger-radweg-einer-bushaltestelle
16298	M1611	1	Radweg auf Wallanlage	non-arg	title	single	CD_M	https://www.raddialog.moers.de/dialoge/moerser-raddialog/radweg-auf-wallanlage
16299	M1611	2	Der für den Radverkehr freigegebene Weg auf der Wallanlage ist nach der Sperrung des Weges entlang dem Seniorenwohnen die einzige Möglichkeit aus den südlich und südöstlich von der Innenstadt gelegenen Stadtteilen in die Innenstadt zu kommen.	premise	text	single	CD_M	https://www.raddialog.moers.de/dialoge/moerser-raddialog/radweg-auf-wallanlage
16300	M1611	3	Dieser Weg ist nach Regenfällen häufig matschig und mit Pfützen versehen.	premise	text	single	CD_M	https://www.raddialog.moers.de/dialoge/moerser-raddialog/radweg-auf-wallanlage
16301	M1611	4	Im Winter ist kein Winterdienst möglich und der Weg häufig stark vereist.	premise	text	single	CD_M	https://www.raddialog.moers.de/dialoge/moerser-raddialog/radweg-auf-wallanlage
16302	M1611	5	In den dunklen Stunden, diese beginnen in den Wintermonaten bereits nachmittags (!) ist der Weg unbeleuchtet uns daher dunkel.	premise	text	single	CD_M	https://www.raddialog.moers.de/dialoge/moerser-raddialog/radweg-auf-wallanlage
16303	M1611	6	Die Begegnung dunkelgekleideter Fußverkehr (häufig auch mit Hund) und Radverkehr ist im Dunkeln nicht ohne.	premise	text	single	CD_M	https://www.raddialog.moers.de/dialoge/moerser-raddialog/radweg-auf-wallanlage
16304	M1612	1	Moerser Straße Radfurt über Wilhelm-Anlahr-Straße	non-arg	title	single	CD_M	https://www.raddialog.moers.de/dialoge/moerser-raddialog/moerser-strasse-radfurt-ueber-wilhelm-anlahr-strasse
16305	M1612	2	Auf der Mittelinsel sind auf beiden Seiten hohe Kanten im Bereich der Radwegeführung.	premise	text	single	CD_M	https://www.raddialog.moers.de/dialoge/moerser-raddialog/moerser-strasse-radfurt-ueber-wilhelm-anlahr-strasse
16306	M1613	1	Radwegqualität	non-arg	title	curated	CD_M	https://www.raddialog.moers.de/dialoge/moerser-raddialog/radwegqualitaet
16307	M1613	2	Radweg von rathausallee Richtung Rheinberg zu schmal für zwei Richtungen und zugewachsen!	premise	text	curated	CD_M	https://www.raddialog.moers.de/dialoge/moerser-raddialog/radwegqualitaet
16308	M1614	1	Bismarckstraße: Fehlender Radweg	premise	title	single	CD_M	https://www.raddialog.moers.de/dialoge/moerser-raddialog/bismarckstrasse-fehlender-radweg
16309	M1614	2	Ein Radweg auf der Bismarckstraße fehlt.	premise	text	single	CD_M	https://www.raddialog.moers.de/dialoge/moerser-raddialog/bismarckstrasse-fehlender-radweg
16310	M1614	3	Es ist eine zentrale Fahrradroute, für die es auch keine möglichen Umfahrungen auf weniger befahrenen Parallelstraßen gibt.	premise	text	single	CD_M	https://www.raddialog.moers.de/dialoge/moerser-raddialog/bismarckstrasse-fehlender-radweg
16311	M1614	4	Insbesondere bei Sperrungen und größeren Staus auf der A40 (Rheinbrücke) wird die Bismarckstraße für den PKW und LKW-Verkehr als Umfahrung genutzt.	premise	text	single	CD_M	https://www.raddialog.moers.de/dialoge/moerser-raddialog/bismarckstrasse-fehlender-radweg
16312	M1614	5	Dies erhöht das Verkehrsaufkommen nochmals.	premise	text	single	CD_M	https://www.raddialog.moers.de/dialoge/moerser-raddialog/bismarckstrasse-fehlender-radweg
16313	M1615	1	Verunreinigung Mehrzweckstreifen Krefelder Straße	premise	title	single	CD_M	https://www.raddialog.moers.de/dialoge/moerser-raddialog/verunreinigung-mehrzweckstreifen-krefelder-strasse
16314	M1615	2	Verbesserungsvorschlag: häufigere Reinigung.	mpos	text	single	CD_M	https://www.raddialog.moers.de/dialoge/moerser-raddialog/verunreinigung-mehrzweckstreifen-krefelder-strasse
16315	M1615	3	Auf dem Mehrzweckstreifen liegen häufig Scherben und Splitt.	premise	text	single	CD_M	https://www.raddialog.moers.de/dialoge/moerser-raddialog/verunreinigung-mehrzweckstreifen-krefelder-strasse
16316	M1615	4	Der Mehrzweckstreifen wird vom Radfahrer genutzt.	premise	text	single	CD_M	https://www.raddialog.moers.de/dialoge/moerser-raddialog/verunreinigung-mehrzweckstreifen-krefelder-strasse
16317	M1615	5	Ein Ausweichen auf die eigentliche Fahrbahn ist aufgrund der hohen KFZ-Belastung nicht sinnvoll.	premise	text	single	CD_M	https://www.raddialog.moers.de/dialoge/moerser-raddialog/verunreinigung-mehrzweckstreifen-krefelder-strasse
16318	M1616	1	Radweg L9 - Verkehrssicherheit	non-arg	title	single	CD_M	https://www.raddialog.moers.de/dialoge/moerser-raddialog/radweg-l9-verkehrssicherheit
16319	M1616	2	Hallo, die L9 benötigt dringend einen separaten Fahrrad &Fußweg neben der KfZ-Fahrbahn.	mpos	text	single	CD_M	https://www.raddialog.moers.de/dialoge/moerser-raddialog/radweg-l9-verkehrssicherheit
16320	M1616	3	Es bedarf einer sicheren Verbindung von Vennikel nach Moers!	mpos	text	single	CD_M	https://www.raddialog.moers.de/dialoge/moerser-raddialog/radweg-l9-verkehrssicherheit
16321	M1616	4	In Holland wäre es schlichtweg verboten, hier Fahrrad zu fahren: Sehr hohe PKW-Geschwindigkeiten trotz Tempo 70, zunehmender LKW Verkehr wegen Copeo, bereits 1 tödlicher tragischer Unfall etc etc.	premise	text	single	CD_M	https://www.raddialog.moers.de/dialoge/moerser-raddialog/radweg-l9-verkehrssicherheit
16322	M1616	5	Viel Erfolg!	non-arg	text	single	CD_M	https://www.raddialog.moers.de/dialoge/moerser-raddialog/radweg-l9-verkehrssicherheit
16323	M1617	1	Fehlende Quarungshilfe Krefelder Straße Höhe Bettenkamper Weg	premise	title	single	CD_M	https://www.raddialog.moers.de/dialoge/moerser-raddialog/fehlende-quarungshilfe-krefelder-strasse-hoehe-bettenkamper-weg
16324	M1617	2	In Fahrtrichtung Kapellen: An dieser Stelle hört der Mehrzweckstreifen auf, auf der gegenüberliegenden Seite beginnt der separat geführte Radweg entlang der Krefelder Straße.	premise	text	single	CD_M	https://www.raddialog.moers.de/dialoge/moerser-raddialog/fehlende-quarungshilfe-krefelder-strasse-hoehe-bettenkamper-weg
16325	M1617	3	Im Berufsverkehr ist diese Stelle aufgrund des hohen Verkehrsaufkommens schwierig zu queren.	premise	text	single	CD_M	https://www.raddialog.moers.de/dialoge/moerser-raddialog/fehlende-quarungshilfe-krefelder-strasse-hoehe-bettenkamper-weg
16326	M1617	4	Zudem ist an der Querungsstelle Tempo 100 zugelassen.	premise	text	single	CD_M	https://www.raddialog.moers.de/dialoge/moerser-raddialog/fehlende-quarungshilfe-krefelder-strasse-hoehe-bettenkamper-weg
16327	M1617	5	Vorschlag: Querungsstelle schaffen oder zumindest die Geschwindigkeit auf Tempo 70 reduzieren, wie es im weiteren Straßenverlauf auch angeordnet ist.	mpos	text	single	CD_M	https://www.raddialog.moers.de/dialoge/moerser-raddialog/fehlende-quarungshilfe-krefelder-strasse-hoehe-bettenkamper-weg
16328	M1617	6	(Krefelder Straße: von Venloer Straße bis Holderberger Straße ist Tempo 70, von Holderberger Straße bis ca. 100m hinter Bettenkamper Weg ist Tempo 100, im weiteren Streckenverlauf wieder Tempo 70).	non-arg	text	single	CD_M	https://www.raddialog.moers.de/dialoge/moerser-raddialog/fehlende-quarungshilfe-krefelder-strasse-hoehe-bettenkamper-weg
16329	M1618	1	Ampel an der Querung Busbahnhof, Grafschafter Rad- und Wanderweg	non-arg	title	single	CD_M	https://www.raddialog.moers.de/dialoge/moerser-raddialog/ampel-der-querung-busbahnhof-grafschafter-rad-und-wanderweg
16330	M1618	2	Die Rotphase für den Rad- und Fußverkehr dauert trotz Anforderung gefühlte Stunden.	premise	text	single	CD_M	https://www.raddialog.moers.de/dialoge/moerser-raddialog/ampel-der-querung-busbahnhof-grafschafter-rad-und-wanderweg
16331	M1618	3	Auch wenn keine Autos auf der Essenberger Straße kommen, bleibt die Ampel lange Zeit stur auf rot.	premise	text	single	CD_M	https://www.raddialog.moers.de/dialoge/moerser-raddialog/ampel-der-querung-busbahnhof-grafschafter-rad-und-wanderweg
